{
  "event_id": "11111111-1111-4111-8111-111111111111",
  "contract_version": "1.0",
  "device_id": "rx5-demo-001",
  "session_id": "session-demo-001",
  "sequence": 0,
  "occurred_at": "2026-09-07T10:00:00Z",
  "type": "hello",
  "payload": {
    "runtime_version": "0.1.0",
    "capabilities": ["simulator", "audio_playback", "short_capture"]
  }
}
